source,link,text,sentiment,score
Reddit,https://www.reddit.com/r/IPUniversity/comments/1rmyn22/bpit_worst_clg/,"BPIT worst clg Bhai mat ana sabse bekar clg h
Campus vaise hi chhota h bhadwo n aur chota kr diya construction k liye
Classes m ac nai h inpe existing cheeze to acchi hoti nai h nayi banne chale h 
Attendance teacher chill nai h itni aur dean  marks kat leta h sala
Aur ye jo maths ki hod h anurima ye sabse jydada bkl h 
Na campus accha h aur rhi bat placement ki vo to lagbhag sare ipu ki ek jaisi h isse accha vips lelo 
Priority rakho
Mait msit bvcoe vips bpit",NEGATIVE,-0.6249
Reddit,https://www.reddit.com/r/IPUniversity/comments/1e78zxa/is_bpit_placement_data_wrong/,Is bpit placement data wrong?  Should i prefer this college. I am getting cse here,NEGATIVE,-0.4767
Reddit,https://www.reddit.com/r/IPUniversity/comments/1pqhj4w/ye_msit_ke_toilets_are_terrible_im_from_bpit_aur/,"ye MSIT ke toilets are TERRIBLE. im from bpit aur yaha centre mila hai. yaha na toh health phoset hai na bidet, and the washroom looks as if no ones been there for a century. koi bacha jaata bhi hai kya?",NEGATIVE,-0.7213
Reddit,https://www.reddit.com/r/IPUniversity/comments/1jxmk1t/bvcoebpit_cse_or_it/,Bvcoe/BPIT (CSE or IT) Is it possible to get IT or Cse in BVCOE OR BPIT at around 3 lakh-3.5 lakh round in the spot rounds? 😭,NEGATIVE,-0.4767
Reddit,https://www.reddit.com/r/IPUniversity/comments/1lucjj7/how_much_ive_to_pay_for_management_quote_to_get/,How much I've to pay for management quote to get admission in BPIT OR MSIT? For btech in CSE,NEGATIVE,-0.1027
Reddit,https://www.reddit.com/r/IPUniversity/comments/1mcyyi9/bpit_fees/,BPIT FEES Do we have to pay rest of the fees through bpit india website?,NEGATIVE,-0.1027
Reddit,https://www.reddit.com/r/IPUniversity/comments/1lc3w50/bpit_vs_bvp_pune_cse_in_both/,"BPIT vs BVP pune (cse in both) Boht zyada cofusion hai  samajh nhi ara what to choose.
BPIT ki cse average 2 lacs zyada hai but college life suffer kregi 
Pls help in decision making. 
I don't want placements or college life to suffer.",NEGATIVE,-0.7804
Reddit,https://www.reddit.com/r/IPUniversity/comments/1mc6pkh/do_i_have_any_chance_to_get_into_bvcoebpit_it/,Do I have any chance to get into bvcoe/bpit IT branch through management quota? I have got 83% aggregate in class 12. I already have a seat in GTB4cec through my jee rank which is very poor.,NEGATIVE,-0.3384
Reddit,https://www.reddit.com/r/IPUniversity/comments/1mczbak/mujhe_bpit_cse_ds_mila_tha_toh_fir_maine_kuch/,Mujhe bpit cse ds mila tha toh fir maine kuch react Kiya nhi tha(was waiting for mhtcet) ab aaj waps login krke dekh rha hu toh no seat alloted dikha rha h why?? Ab next allotment ya spot kab hai?,NEGATIVE,-0.4098
Careers360,https://www.careers360.com/colleges/bhagwan-parshuram-institute-of-technology-delhi/reviews,"If your rank is very bad and can't afford then, go for it",NEGATIVE,-0.5849
Collegedunia,https://collegedunia.com/college/13032-bhagwan-parshuram-institute-of-technology-bpit-new-delhi/reviews,Campus size is only 5 acres so that is a negative for the college.,NEGATIVE,-0.5719
Collegedunia,https://collegedunia.com/college/13032-bhagwan-parshuram-institute-of-technology-bpit-new-delhi/reviews,Infrastructure is too small and not well used many places are empty which can be filled with something and there is no ac in classrooms,NEGATIVE,-0.5878
Collegedunia,https://collegedunia.com/college/13032-bhagwan-parshuram-institute-of-technology-bpit-new-delhi/reviews,Infrastructure is not so good and classroom are non ac,NEGATIVE,-0.464
YouTube,https://www.youtube.com/watch?v=WQO8sAUbEN8,Bhai 66% hai ab jee kahaa se du😢,NEGATIVE,-0.4767
YouTube,https://www.youtube.com/watch?v=FXPnPYo04a8,Bhai without jee mains ki rank ke bina Mtlb donation se admission hate hai kya plz reply,NEGATIVE,-0.5267
YouTube,https://www.youtube.com/watch?v=l3iwTs51wF0,Sliding round m kitni cut off jygi??,NEGATIVE,-0.3527
YouTube,https://www.youtube.com/watch?v=l3iwTs51wF0,"Bhaiya meri rank 113095 h (Delhi quota), general
Kya merko cse/it milegi kisi ache ipu college me kisi bhi round me😢😢😢😢",NEGATIVE,-0.9325
